/*
@author : Sajan

*/

#Welcome to Employee Payroll Service Database

//Use Case 1 Create a Database

mysql> create database payroll_service;
Query OK, 1 row affected (0.16 sec)

mysql> show databases;
+--------------------+
| Database           |
+--------------------+
| employee_wage      |
| information_schema |
| mysql              |
| pay_roll           |
| payroll_service    |
| payroll_service1   |
| performance_schema |
| sakila             |
| sys                |
| world              |
+--------------------+
10 rows in set (0.08 sec)

mysql> use payroll_service;
Database changed
mysql>
------------------------------------------------------------------------
//Use Case 2 Create a Table

mysql> use payroll_service;
Database changed

mysql> CREATE TABLE `pay_roll`.`employee_payroll` 
(  `id` INT NOT NULL,  `name` VARCHAR(45) NOT NULL, 
 `salary` INT NOT NULL,  
`start date` DATE NOT NULL,  PRIMARY KEY (`id`));
Query OK, 0 rows affected (1.58 sec)

------------------------------------------------------------------------
//Use Case 3 Insert Operation

mysql> INSERT INTO `pay_roll`.`employee_payroll` 
(`id`, `name`, `salary`, 'date`) 
VALUES ('126', 'Rahul', '600000', '2018-07-21');
INSERT INTO `pay_roll`.`employee_payroll` 
(`id`, `name`, `salary`, 'date`) 
VALUES ('127', 'Yash', '550000', '2106-09-15');
Query OK, 1 row affected (0.12 sec)

Query OK, 1 row affected (0.10 sec)

------------------------------------------------------------------------
//Use Case 4 Select Operation

mysql> SELECT * FROM pay_roll.employee_payroll;
+-----+--------+--------+------------+
| id  | name   | salary | date |
+-----+--------+--------+------------+
| 123 | Sajan  | 400000 | 2012-02-18 |
| 124 | Raj    | 500000 | 2019-04-22 |
| 125 | Akshay | 520000 | 2019-06-12 |
| 126 | Rahul  | 600000 | 2018-07-21 |
| 127 | Yash   | 550000 | 2016-09-15 |
+-----+--------+--------+------------+
5 rows in set (0.05 sec)

------------------------------------------------------------------------
//Use Case 5 Where Operation

mysql> SELECT salary from pay_roll.employee_payroll23 WHERE name = 'Sajan';
+--------+
| salary |
+--------+
| 400000 |
+--------+
1 row in set (0.00 sec)

mysql> SELECT * FROM payroll_service.employee_payroll 
WHERE date BETWEEN CAST('2018-01-01'AS DATE) AND DATE(NOW());
+-----+--------+--------+------------+
| id  | name   | salary | date       |
+-----+--------+--------+------------+
| 124 | Raj    | 500000 | 2019-04-22 |
| 125 | Akshay | 520000 | 2019-06-12 |
| 126 | Rahul  | 600000 | 2018-07-21 |
+-----+--------+--------+------------+
3 rows in set (0.00 sec)
------------------------------------------------------------------------
//Use Case 6 Alter Operation

mysql> ALTER TABLE `payroll_service`.`employee_payroll` ADD COLUMN `gender` VARCHAR(45) NOT NULL AFTER `name`;
Query OK, 0 rows affected (2.30 sec)
Records: 0  Duplicates: 0  Warnings: 0

mysql> UPDATE `payroll_service`.`employee_payroll` SET `gender` = 'M' WHERE (`name` = 'Sajan');
Query OK, 1 row affected (0.10 sec)
Rows matched: 1  Changed: 1  Warnings: 0

mysql> UPDATE `payroll_service`.`employee_payroll` SET `gender` = 'M' WHERE (`name` = 'Akshay');
Query OK, 1 row affected (0.13 sec)
Rows matched: 1  Changed: 1  Warnings: 0

mysql> UPDATE `payroll_service`.`employee_payroll` SET `gender` = 'M' WHERE (`name` = 'Raj');
Query OK, 1 row affected (0.15 sec)
Rows matched: 1  Changed: 1  Warnings: 0

mysql> UPDATE `payroll_service`.`employee_payroll` SET `gender` = 'M' WHERE (`name` = 'Rahul');
Query OK, 1 row affected (0.19 sec)
Rows matched: 1  Changed: 1  Warnings: 0

mysql> UPDATE `payroll_service`.`employee_payroll` SET `gender` = 'M' WHERE (`name` = 'Yash');
Query OK, 1 row affected (0.08 sec)
Rows matched: 1  Changed: 1  Warnings: 0

mysql> SELECT * FROM payroll_service.employee_payroll;
+-----+--------+--------+--------+------------+
| id  | name   | gender | salary | date       |
+-----+--------+--------+--------+------------+
| 123 | Sajan  | M      | 400000 | 2012-02-18 |
| 124 | Raj    | M      | 500000 | 2019-04-22 |
| 125 | Akshay | M      | 520000 | 2019-06-12 |
| 126 | Rahul  | M      | 600000 | 2018-07-21 |
| 127 | Yash   | M      | 550000 | 2016-09-15 |
+-----+--------+--------+--------+------------+
5 rows in set (0.00 sec)
------------------------------------------------------------------------
// Use Case 7 Ability to find sum of salary of male and female employees

mysql> SELECT SUM(salary) FROM  payroll_service.employee_payroll WHERE gender = 'M' GROUP BY gender;
+-------------+
| SUM(salary) |
+-------------+
|     2570000 |
+-------------+
1 row in set (0.00 sec)
