/*
@author : Sajan

*/

#Welcome to Employee Payroll Service Database

//Use Case 1 Create a Database

mysql> create database payroll_service;
Query OK, 1 row affected (0.16 sec)

mysql> show databases;
+--------------------+
| Database           |
+--------------------+
| employee_wage      |
| information_schema |
| mysql              |
| pay_roll           |
| payroll_service    |
| payroll_service1   |
| performance_schema |
| sakila             |
| sys                |
| world              |
+--------------------+
10 rows in set (0.08 sec)

mysql> use payroll_service;
Database changed
mysql>
------------------------------------------------------------------------
//Use Case 2 Create a Table

mysql> use payroll_service;
Database changed

mysql> CREATE TABLE `pay_roll`.`employee_payroll` 
(  `id` INT NOT NULL,  `name` VARCHAR(45) NOT NULL, 
 `salary` INT NOT NULL,  
`start date` DATE NOT NULL,  PRIMARY KEY (`id`));
Query OK, 0 rows affected (1.58 sec)

------------------------------------------------------------------------
//Use Case 3 Insert Operation

mysql> INSERT INTO `pay_roll`.`employee_payroll` 
(`id`, `name`, `salary`, 'date`) 
VALUES ('126', 'Rahul', '600000', '2018-07-21');
INSERT INTO `pay_roll`.`employee_payroll` 
(`id`, `name`, `salary`, 'date`) 
VALUES ('127', 'Yash', '550000', '2106-09-15');
Query OK, 1 row affected (0.12 sec)

Query OK, 1 row affected (0.10 sec)

------------------------------------------------------------------------
//Use Case 4 Select Operation

mysql> SELECT * FROM pay_roll.employee_payroll;
+-----+--------+--------+------------+
| id  | name   | salary | date |
+-----+--------+--------+------------+
| 123 | Sajan  | 400000 | 2012-02-18 |
| 124 | Raj    | 500000 | 2019-04-22 |
| 125 | Akshay | 520000 | 2019-06-12 |
| 126 | Rahul  | 600000 | 2018-07-21 |
| 127 | Yash   | 550000 | 2016-09-15 |
+-----+--------+--------+------------+
5 rows in set (0.05 sec)

------------------------------------------------------------------------
//Use Case 5 Where Operation

mysql> SELECT salary from pay_roll.employee_payroll23 WHERE name = 'Sajan';
+--------+
| salary |
+--------+
| 400000 |
+--------+
1 row in set (0.00 sec)

mysql> SELECT * FROM payroll_service.employee_payroll 
WHERE date BETWEEN CAST('2018-01-01'AS DATE) AND DATE(NOW());
+-----+--------+--------+------------+
| id  | name   | salary | date       |
+-----+--------+--------+------------+
| 124 | Raj    | 500000 | 2019-04-22 |
| 125 | Akshay | 520000 | 2019-06-12 |
| 126 | Rahul  | 600000 | 2018-07-21 |
+-----+--------+--------+------------+
3 rows in set (0.00 sec)
------------------------------------------------------------------------
//Use Case 6 Alter Operation

mysql> ALTER TABLE `payroll_service`.`employee_payroll` ADD COLUMN `gender` VARCHAR(45) NOT NULL AFTER `name`;
Query OK, 0 rows affected (2.30 sec)
Records: 0  Duplicates: 0  Warnings: 0

mysql> UPDATE `payroll_service`.`employee_payroll` SET `gender` = 'M' WHERE (`name` = 'Sajan');
Query OK, 1 row affected (0.10 sec)
Rows matched: 1  Changed: 1  Warnings: 0

mysql> UPDATE `payroll_service`.`employee_payroll` SET `gender` = 'M' WHERE (`name` = 'Akshay');
Query OK, 1 row affected (0.13 sec)
Rows matched: 1  Changed: 1  Warnings: 0

mysql> UPDATE `payroll_service`.`employee_payroll` SET `gender` = 'M' WHERE (`name` = 'Raj');
Query OK, 1 row affected (0.15 sec)
Rows matched: 1  Changed: 1  Warnings: 0

mysql> UPDATE `payroll_service`.`employee_payroll` SET `gender` = 'M' WHERE (`name` = 'Rahul');
Query OK, 1 row affected (0.19 sec)
Rows matched: 1  Changed: 1  Warnings: 0

mysql> UPDATE `payroll_service`.`employee_payroll` SET `gender` = 'M' WHERE (`name` = 'Yash');
Query OK, 1 row affected (0.08 sec)
Rows matched: 1  Changed: 1  Warnings: 0

mysql> SELECT * FROM payroll_service.employee_payroll;
+-----+--------+--------+--------+------------+
| id  | name   | gender | salary | date       |
+-----+--------+--------+--------+------------+
| 123 | Sajan  | M      | 400000 | 2012-02-18 |
| 124 | Raj    | M      | 500000 | 2019-04-22 |
| 125 | Akshay | M      | 520000 | 2019-06-12 |
| 126 | Rahul  | M      | 600000 | 2018-07-21 |
| 127 | Yash   | M      | 550000 | 2016-09-15 |
+-----+--------+--------+--------+------------+
5 rows in set (0.00 sec)
------------------------------------------------------------------------
// Use Case 7 Ability to find sum of salary of male and female employees

mysql> SELECT SUM(salary) FROM  payroll_service.employee_payroll WHERE gender = 'M' GROUP BY gender;
+-------------+
| SUM(salary) |
+-------------+
|     2570000 |
+-------------+
1 row in set (0.00 sec)

------------------------------------------------------------------------
/* Use Case 8 Ability to extend employee_payroll
data to store employee information like
employee phone, address and department */

mysql> Alter TABLE employee_payroll ADD address VARCHAR(250) AFTER phone_number;
Query OK, 0 rows affected (2.05 sec)
Records: 0  Duplicates: 0  Warnings: 0

mysql> Alter TABLE employee_payroll ADD department VARCHAR(250) AFTER address;
Query OK, 0 rows affected (2.28 sec)
Records: 0  Duplicates: 0  Warnings: 0

mysql> select * from employee_payroll;
+-----+---------+--------------+---------+------------+--------+--------+------------+
| id  | name    | phone_number | address | department | gender | salary | date       |
+-----+---------+--------------+---------+------------+--------+--------+------------+
| 123 | Sajan   | NULL         | NULL    | NULL       | M      | 400000 | 2012-02-18 |
| 124 | Raj     | NULL         | NULL    | NULL       | M      | 500000 | 2019-04-22 |
| 125 | Raju    | NULL         | NULL    | NULL       | M      | 520000 | 2019-06-12 |
| 126 | Raju    | NULL         | NULL    | NULL       | M      | 600000 | 2018-07-21 |
| 127 | Sheetal | NULL         | NULL    | NULL       | F      | 550000 | 2016-09-15 |
+-----+---------+--------------+---------+------------+--------+--------+------------+
5 rows in set (0.06 sec)

mysql> Alter TABLE employee_payroll ADD phone_number VARCHAR(250) AFTER name;
Query OK, 0 rows affected (2.34 sec)
Records: 0  Duplicates: 0  Warnings: 0

mysql> select * from employee_payroll;
+-----+---------+--------------+--------+--------+------------+
| id  | name    | phone_number | gender | salary | date       |
+-----+---------+--------------+--------+--------+------------+
| 123 | Sajan   | NULL         | M      | 400000 | 2012-02-18 |
| 124 | Raj     | NULL         | M      | 500000 | 2019-04-22 |
| 125 | Raju    | NULL         | M      | 520000 | 2019-06-12 |
| 126 | Raju    | NULL         | M      | 600000 | 2018-07-21 |
| 127 | Sheetal | NULL         | F      | 550000 | 2016-09-15 |
+-----+---------+--------------+--------+--------+------------+
5 rows in set (0.00 sec)

mysql> Alter TABLE employee_payroll ADD address VARCHAR(250) AFTER phone_number;
Query OK, 0 rows affected (1.45 sec)
Records: 0  Duplicates: 0  Warnings: 0

mysql> select * from employee_payroll;
+-----+---------+--------------+---------+--------+--------+------------+
| id  | name    | phone_number | address | gender | salary | date       |
+-----+---------+--------------+---------+--------+--------+------------+
| 123 | Sajan   | NULL         | NULL    | M      | 400000 | 2012-02-18 |
| 124 | Raj     | NULL         | NULL    | M      | 500000 | 2019-04-22 |
| 125 | Raju    | NULL         | NULL    | M      | 520000 | 2019-06-12 |
| 126 | Raju    | NULL         | NULL    | M      | 600000 | 2018-07-21 |
| 127 | Sheetal | NULL         | NULL    | F      | 550000 | 2016-09-15 |
+-----+---------+--------------+---------+--------+--------+------------+
5 rows in set (0.00 sec)

mysql> Alter TABLE employee_payroll ADD department VARCHAR(250) NOT NULL AFTER address;
Query OK, 0 rows affected (2.02 sec)
Records: 0  Duplicates: 0  Warnings: 0

mysql> select * from employee_payroll;
+-----+---------+--------------+---------+------------+--------+--------+------------+
| id  | name    | phone_number | address | department | gender | salary | date       |
+-----+---------+--------------+---------+------------+--------+--------+------------+
| 123 | Sajan   | NULL         | NULL    |            | M      | 400000 | 2012-02-18 |
| 124 | Raj     | NULL         | NULL    |            | M      | 500000 | 2019-04-22 |
| 125 | Raju    | NULL         | NULL    |            | M      | 520000 | 2019-06-12 |
| 126 | Raju    | NULL         | NULL    |            | M      | 600000 | 2018-07-21 |
| 127 | Sheetal | NULL         | NULL    |            | F      | 550000 | 2016-09-15 |
+-----+---------+--------------+---------+------------+--------+--------+------------+
5 rows in set (0.00 sec)

mysql> Alter TABLE employee_payroll ALTER address SET DEFAULT 'TBD';
Query OK, 0 rows affected (0.54 sec)
Records: 0  Duplicates: 0  Warnings: 0

mysql> select * from employee_payroll;
+-----+---------+--------------+---------+------------+--------+--------+------------+
| id  | name    | phone_number | address | department | gender | salary | date       |
+-----+---------+--------------+---------+------------+--------+--------+------------+
| 123 | Sajan   | NULL         | NULL    |            | M      | 400000 | 2012-02-18 |
| 124 | Raj     | NULL         | NULL    |            | M      | 500000 | 2019-04-22 |
| 125 | Raju    | NULL         | NULL    |            | M      | 520000 | 2019-06-12 |
| 126 | Raju    | NULL         | NULL    |            | M      | 600000 | 2018-07-21 |
| 127 | Sheetal | NULL         | NULL    |            | F      | 550000 | 2016-09-15 |
+-----+---------+--------------+---------+------------+--------+--------+------------+
5 rows in set (0.06 sec)

mysql> describe employee_payroll;
+--------------+--------------+------+-----+---------+-------+
| Field        | Type         | Null | Key | Default | Extra |
+--------------+--------------+------+-----+---------+-------+
| id           | int          | NO   | PRI | NULL    |       |
| name         | varchar(45)  | NO   |     | NULL    |       |
| phone_number | varchar(250) | YES  |     | NULL    |       |
| address      | varchar(250) | YES  |     | TBD     |       |
| department   | varchar(250) | NO   |     | NULL    |       |
| gender       | varchar(45)  | NO   |     | NULL    |       |
| salary       | int          | NO   |     | NULL    |       |
| date         | date         | NO   |     | NULL    |       |
+--------------+--------------+------+-----+---------+-------+
8 rows in set (0.08 sec)

mysql> INSERT INTO `payroll_service`.`employee_payroll` (`name`, `salary`, `date`) VALUES ('Mark', '630000', '2019-05-18');
ERROR 1364 (HY000): Field 'id' doesn't have a default value


------------------------------------------------------------------------
/* Use Case 9 Ability to extend
employee_payroll table to have Basic Pay, Deductions, Taxable Pay,
Income Tax, Net Pay */

mysql> Alter Table employee_payroll RENAME COLUMN salary TO basic_pay;
Query OK, 0 rows affected (0.34 sec)
Records: 0  Duplicates: 0  Warnings: 0

mysql> show tables;
+---------------------------+
| Tables_in_payroll_service |
+---------------------------+
| employee_payroll          |
+---------------------------+
1 row in set (0.11 sec)

mysql> describe employee_payroll;
+--------------+--------------+------+-----+---------+-------+
| Field        | Type         | Null | Key | Default | Extra |
+--------------+--------------+------+-----+---------+-------+
| id           | int          | NO   | PRI | NULL    |       |
| name         | varchar(45)  | NO   |     | NULL    |       |
| phone_number | varchar(250) | YES  |     | NULL    |       |
| address      | varchar(250) | YES  |     | TBD     |       |
| department   | varchar(250) | NO   |     | NULL    |       |
| gender       | varchar(45)  | NO   |     | NULL    |       |
| basic_pay    | int          | NO   |     | NULL    |       |
| date         | date         | NO   |     | NULL    |       |
+--------------+--------------+------+-----+---------+-------+
8 rows in set (0.01 sec)

mysql> Alter TABLE employee_payroll ADD deductions DOUBLE NOT NULL AFTER basic_pay;
Query OK, 0 rows affected (1.77 sec)
Records: 0  Duplicates: 0  Warnings: 0

mysql> Alter TABLE employee_payroll ADD taxable_pay DOUBLE NOT NULL AFTER deductions;
Query OK, 0 rows affected (2.24 sec)
Records: 0  Duplicates: 0  Warnings: 0

mysql> Alter TABLE employee_payroll ADD income_tax DOUBLE NOT NULL AFTER taxable_pay;
Query OK, 0 rows affected (1.91 sec)
Records: 0  Duplicates: 0  Warnings: 0

mysql> Alter TABLE employee_payroll ADD net_pay DOUBLE NOT NULL AFTER income_tax;
Query OK, 0 rows affected (2.53 sec)
Records: 0  Duplicates: 0  Warnings: 0

mysql> describe employee_payroll;
+--------------+--------------+------+-----+---------+-------+
| Field        | Type         | Null | Key | Default | Extra |
+--------------+--------------+------+-----+---------+-------+
| id           | int          | NO   | PRI | NULL    |       |
| name         | varchar(45)  | NO   |     | NULL    |       |
| phone_number | varchar(250) | YES  |     | NULL    |       |
| address      | varchar(250) | YES  |     | TBD     |       |
| department   | varchar(250) | NO   |     | NULL    |       |
| gender       | varchar(45)  | NO   |     | NULL    |       |
| basic_pay    | int          | NO   |     | NULL    |       |
| deductions   | double       | NO   |     | NULL    |       |
| taxable_pay  | double       | NO   |     | NULL    |       |
| income_tax   | double       | NO   |     | NULL    |       |
| net_pay      | double       | NO   |     | NULL    |       |
| date         | date         | NO   |     | NULL    |       |
+--------------+--------------+------+-----+---------+-------+
12 rows in set (0.02 sec)

mysql> UPDATE `payroll_service`.`employee_payroll` SET `department` = 'Sales' WHERE (`name` = 'Sajan');
Query OK, 1 row affected (0.13 sec)
Rows matched: 1  Changed: 1  Warnings: 0

mysql> INSERT INTO `payroll_service`.`employee_payroll`
(`id`, `name`, `department`, `gender`, `basic_pay`, `deductions`, `taxable_pay`, `income_tax`, `net_pay`, `date`)
 VALUES ('128', 'Rani', 'HR', 'F', '300000', '100000', '50000', '30000', '250000', '2019-07-12');
Query OK, 1 row affected (0.05 sec)

mysql> select * from employee_payroll;
+-----+---------+--------------+---------+------------+--------+-----------+------------+-------------+------------+---------+------------+
| id  | name    | phone_number | address | department | gender | basic_pay | deductions | taxable_pay | income_tax | net_pay | date       |
+-----+---------+--------------+---------+------------+--------+-----------+------------+-------------+------------+---------+------------+
| 123 | Sajan   | NULL         | NULL    | Sales      | M      |    400000 |          0 |           0 |          0 |       0 | 2012-02-18 |
| 124 | Raj     | NULL         | NULL    |            | M      |    500000 |          0 |           0 |          0 |       0 | 2019-04-22 |
| 125 | Raju    | NULL         | NULL    |            | M      |    520000 |          0 |           0 |          0 |       0 | 2019-06-12 |
| 126 | Raju    | NULL         | NULL    |            | M      |    600000 |          0 |           0 |          0 |       0 | 2018-07-21 |
| 127 | Sheetal | NULL         | NULL    |            | F      |    550000 |          0 |           0 |          0 |       0 | 2016-09-15 |
| 128 | Rani    | NULL         | TBD     | HR         | F      |    300000 |     100000 |       50000 |      30000 |  250000 | 2019-07-12 |
+-----+---------+--------------+---------+------------+--------+-----------+------------+-------------+------------+---------+------------+
6 rows in set (0.00 sec)